"2:10:02","적용 됐어요 아직 덜 됐어요 아까 보니까 밥 먹다가 구글 썼더라고요 시차 종이 안 돼 가지고 언제이 아침"
"2:10:09","방금 금 아 방금 오늘 아침에 또 했었잖아요네 그렇죠 아 시차 종 좀"
"2:10:14","되세요 근데 저는 어 항상 피곤하기 때문에 시차 적이 너무 쉽습니다 아"
"2:10:21","그렇구나 사실 컨디션이 항상 최저에요 시차 정이라는게 있을 수가 없어요 저는 아직 안 돼 가지고 너무"
"2:10:29","힘듭니다네 이게 제 마이크가 근데 예 아니 저희 같이 쓰는 마이크대 차라리 그러면 저희 화면을 살짝 키워서 예"
"2:10:36","아 그럴까요 저희 조금만 키워서 개회식을 아예 덮으면"
"2:10:42","살짝 아 아 어 이렇게 됐습니다 두 가지가 두 가지 콘텐츠가 있으니까 약간 죄송하네요 예 예 아무튼 자"
"2:10:50","이번에 네 배드민턴 해설를 또 SBS 맡게는데 이렇게 현지 중계 또 처음이잖아요 그죠네 그렇죠 저 현지"
"2:10:56","와서 전 도쿄 올림픽도 그 이제 우리나라에서 했었고 이번 현재 왔는데"
"2:11:02","좀네 새로운 것들도 많이 하고 좀 재밌는 거 같습니다네 사실 근데 아직 현역이네 선수예요 아직 근데 이제"
"2:11:09","현역 선수지만 해설도 같이 이게 어 권위가 굉장히 높아야"
"2:11:14","이제 이게 가능한 거 아니겠습니까네 그 어떤 선수로서 이제 이룩한 게도 많고 이렇게 하셔야지"
"2:11:20","이게 또 해설도 하실 수 있는 거 아닌가 그렇죠 2008년 그 베이징 올림픽 때 딱 그 윙크 보 복식에서"
"2:11:28","예음 잘 아시네요 우리음 사실 많이"
"2:11:33","알지만 워낙 유명하시고 저 같은 이제 좀 잘 모르는 사람도 이제 요번에 좀"
"2:11:39","기대하는 선수네 아 배 후배들을 소개해 주신다면 그렇죠 지금 이제 배드민턴이 좀 약간 황금기에"
"2:11:46","있습니다네 그래서 워낙에 지금 안세영 선수가 메달 후보로 꼽히고 있고 또"
"2:11:51","나머지 종목들도 아주 좋거든요 뭐 여자복식 혼합복식 또 남자 복식까지"
"2:11:57","매달권 진입의 개 좀 있기 때문에 이번 배드민턴은 좀 많은 분들이 좀"
"2:12:03","관심과 응원 좀 많이 해 주셨으면 좋겠습니다 제가 사실 잘 모 모르는데"
"2:12:08","배드민턴이 우리나라가 되게 강해요 우리나라가 또 그 약수터의 민족 아니겠습니까 배드민턴의 턴이 사실"
"2:12:15","우리나라 저변이 최강국 급이죠 그렇군 사실 이제 축구랑 배드민턴 많이"
"2:12:22","치잖아 어르신들이 그죠 아네 이제 윙크보이 이용대의 소리 이게 지금"
"2:12:27","되게 차분하고 잘생겼고 윙크 잘하고 약간 이런 캐릭터지만 중계 들어가면"
"2:12:33","또 벌게 되게 사 나와요 벌게 하세요 살벌하게 소리 질러요 후배가 뭐"
"2:12:38","하나가 셔트 콩 놓쳤다 그러면 아 저 안 된다고 그러면서 경을 치시나요 예 해설"
"2:12:45","하셔야 되는데 아 집중 혹시을 집중하면 막 이성을 있는 스타일이 가지고 아 이게 너무 몰입을 하시니까"
"2:12:53","아 그러면 그 이게 이게 보시는 분들도 전달이 잘 되겠네요 이떤 감정이나 어떤 상황이나 그렇죠 그죠음"
"2:12:59","아 튼 지금 내일 여기 시간으로 새벽부터 준비해야 돼요네 지금 잘"
"2:13:06","시간이 얼 별로 없어요 아 그래요 그럼 준비는 다 이게 좀 다 잘하셨나요네 준비 잘했고 또 내일 첫"
"2:13:13","번째 게임 이제 혼합복식부터 시작을 하거든요 이제 혼합복식 잘하게 되면이 나머지 종목들도 아마 잘하지 않을까"
"2:13:20","누구누구 나 고 내일 뭐 모든 종목이야네 혼합복식에 서승제 최효정"
"2:13:26","선수 그리고 이제 여자 복식의 김소영 공영 선수 또 하나의 여자 복식인"
"2:13:31","이제 백하나 이소희 선수가 내 경기를 갖게 되겠습니다네 뭐 아프겠는데 제가서 목캔디 다이 약을 다 줬어요"
"2:13:39","아 맞아요네 그게 도움이 되나요 모 캔디로 아 제가 약간의 감기 기운이 있어 가지고 제가 형한테 물어봤죠"
"2:13:45","성재 형께네 무조건 이제 뭐 약을 가지고 다닐 거 같잖아요 워낙에 목을 많이 쓰시니까 많네 그래서 약"
"2:13:52","있습니까지 물어봤는데 와 약이 좋은 것들로만 가지고 다니세요 역시 다르다"
"2:13:58","어 어 저도 좀 필요하면 언제든지 제가 창맨 건강 제가 건강 관리까지 다 책임지고 있는 거예요 아 그래요"
"2:14:04","아 저 그냥 비싸다고 해가지고 비싼 약이라고 해서 아니 언제 그래 좋은 약이 비싸잖아요 아 그렇죠 예 몸에"
"2:14:10","쓴 약이 또 좋고 아 그렇 자 그러면 이용대 내일도 아침 중계 해야 되니까 저희가 이렇게 길게 못 잡고 보내드리"
"2:14:17","하겠습니다 내일 잘 부탁드리고 손 한번 잡아보세요 손 이거 잡는 선수니까 아 그러네요 엄청 이게 그"
"2:14:24","굳은 살로 가득차 제 손은 완전 말랑말랑 아무것도 아니 왜 이렇게"
"2:14:29","고아 기 만화가의 손이 아니 고생을 안 하 고생을 안 해어 손을 잘 안"
"2:14:37","써서음 자 그러면 상반된 손 네일 잘 부탁드립니다네 가보겠습니다네"
"2:14:42","또뵙겠습니다 빨리 자야 돼요 빨리 자야"
"2:14:48","돼요 자 저희가 이제 또 그 여기 현지에 와 있는 해설 위원들을 모시고"
"2:14:56","토크를 잠깐 하려고 했는데네 개회식이 워낙 또 악원 영상들이 나오니까 많은"
"2:15:03","분들이 적어 봐야 되는데이 얘기하고이 얘기하는데 적어 봐야 되고 뭐 이렇게 좀 그러셔서"
"2:15:09","죄송하네요 많이 죄송한요 예 몸들 바를 모르겠네요 몸들 모르겠어요"
"2:15:15","어떻게 조절해 근데 저 약간 궁금한게 있는데요 전 종목을 다 중계할 수는 없잖아요 그렇죠 왜냐면 시간이"
"2:15:22","겹치니까 겹치 여러분 지금 바로 어 마린보이"
"2:15:27","와도 토크를 하고 예 지금 공연할 때 그래도 하는게 날"
"2:15:33","거 같아요 예 왜냐면 좀 더 끌다 보면은 또 선수들도 그렇고 성화"
"2:15:40","정화자가 들어올 수도 있으니까음음 섭외를 저희가 미리 대기를 시키 원래는에서 쉬셔야 되는"
"2:15:46","분들인데 쉬 쉬셔야 되는데 저희가 또 요청을 드렸기 때문에음 양해를 좀"
"2:15:53","부탁드리겠습니다네 어 그러면 이제 중계가 겹치면 이제 좀 안 되는 경우도 있겠네요 그렇죠 그러니까 저"
"2:16:00","같은 경우에도 배드민턴이란 수영이 좀 겹치는 대들이 많아 가지고 초반에는 배드민턴을 아마 이재현 캐스터랑"
"2:16:06","윤성호 캐스터가 번갈아가면서 하고 예 제가 수영이 이제슬 끝날 때쯤에 또"
"2:16:11","체인지를 하고 이럴 것 같습니다음 어 이따가 이제 박태 해설"
"2:16:18","위원님 잠깐 보시고 얘기 나눠 보고요네 어 바로 그이 개막식 개회식 볼 수 있을 것"
"2:16:25","같습니다네 초반에 어 손님들과 빨리 이야기를 하고 예 아 오시고 계세요"
"2:16:33","예예 여기 또 유리창으로 또 뚫려 있거든요 예 이거를 미리 놔야겠다"
"2:16:40","가운데 어서 오십시오네 안녕하십니까 아 어서 오십시오 안녕하세요 안녕하세 자 분"
"2:16:48","마린보이 박태환 해설입니다 우와 와 신기하다 와 자 그동안 혹시"
"2:16:55","침착맨 어 침투부에 대해서 어떻게 어 뭘 어떻게 해세요 뭘 어떻게 알고"
"2:17:00","계십니까 어 잘 지내셨어요 아 잘 지냈죠 그때 촬영할 때 해 지셨네요"
"2:17:05","그 화장 펴발라 가지고요 잠깐 일시적으로 얼굴이 작아졌습니다 아 그래요 어 아 또 올림픽 오신다고"
"2:17:13","엄청 신경 쓰시고 오셨네요 제가 사실 많이 알지는 못하는데네 근데 준비는"
"2:17:18","잘하셨나요 아네 뭐 지금 계속 공부하다가네 내일 바로 또 이제네"
"2:17:24","제일 중요한 400m 있고네 또 침착하게 준비하다가 불러 주셔 가지고"
"2:17:31","침착은 기억이 아 되게 웃 우상이에요 계시게 싱글 싱글방글 어 예 저 저"
"2:17:37","예 잘 오세요 아 인생이 너무 좋으세요 아 기분 좋게 하는 스타일이에요 박태원이 그리고 그 기억"
"2:17:43","안 나시겠지만 2008년 이제 베이징 하계 올림픽 때 그때가 이제 우리나라 스포츠 진짜 거의 막 국제대회에서 서"
"2:17:51","온갖 성적들이 잘 나오던고 근처 연도에 근데 그때 올림픽 시작하고"
"2:17:57","1호 메달은 유도 최민호 선수였고 그 직후에 박태현의 세련이 400m"
"2:18:02","자유형에서 금메달을 땄어요 그래가지고 아 올림픽 분위기가 진짜 어 지금이랑"
"2:18:08","비슷했어 그냥 올림픽 하는 거야 뭐 이러 있다가 빵 올라갔어 진 어 아 근데 너무"
"2:18:14","오래됐다은 아 근데 그게 있어이 초반에 그 근데 그 수영이 아까"
"2:18:19","얘기한 것처럼 올림픽에 전반부를 담당하는데 그 맨 앞에 4유형"
"2:18:25","400이 있어요 아 베이징 20년도 안 됐어요 예 최근이에요 아"
"2:18:30","그래가지고 얼마 16년 16년 됐나 그래서 이제 16년 이면은 8 10년"
"2:18:37","안 됐네 내일이 딱 그거거든 16년 전처럼 이제 남자 자유형 400m"
"2:18:42","김우민 선수가 딱 도전하는 곧 내일이 바로 시작하니까 내일 우리나라 또"
"2:18:48","수영 강하지 않아요 어 지금 예 황금 황금 세대 예 넥타이 색깔 아 아"
"2:18:55","그렇죠 황금 세대 그래서 그 아까 그 낮에 그 배성재 캐신 님하고 이제 식사하면서 많이 기대하고 계시더라고요"
"2:19:02","수영 어네네네음 내일 침착맨 do 수영장에 또 맞아요 또 별 거예요"
"2:19:07","아마 내일 내일 오세요 현장 이제 응원 응원하러 파병 님하고 예 어 두"
"2:19:12","분 같이 오시는구나 그렇죠 예 저희는 그 세트예요 올림픽에서는 침착한 바리 지행 해가지고 어 좋다 좋다"
"2:19:19","그러니까네 자 어쨌든 이번에 그러면 박 김민 선수랑 그다음에 황선우 선수"
"2:19:25","황선우 선수 그리고 이제 또 단체전 예 개형 800m"
"2:19:30","있는데음 아 내심 좀 아쉬 저는 개인적으로 좀 아쉬운 점도 있어요 왜"
"2:19:37","이런 훌륭한 선수들이네 이제 나왔을까 왜 내가 했을 때는 안 나왔을까 태연이 할"
"2:19:45","때는 혼자 거의 다 전 종목 뭐 100m 터 10000m 아지 네네네"
"2:19:51","아 그게 같이 이게 딱 이게 그 시기가 겹치면 아무래도 좀 더"
"2:19:56","시너지가 있나요 그럼요 왜냐면 이제 미국 같은 데는 수영 강한 선수들이 여럿 있으니까 예 아 제가 해설하고"
"2:20:03","앉아 있네요 예 사실 저도 YMC 수영 선수 출신이거든요 선배님이 될"
"2:20:09","뻔하다가 아 근데 왜 무슨 이유로 저는 또 말하는게 더"
"2:20:15","좋아서 먹는게 먹는게 더 좋아서 아 아 제 몸 쓰는 거보다 말이 낫다"
"2:20:22","말이 낫다 앉아 있는게 편하니까 재능이 많은 것도 참 사실 힘든 일이에요 말도 잘하고 운동도 잘하고"
"2:20:28","예 예 몸 보세요 거의 뭐 어깨 빵이 제가 어깨 빵이 아니라 여기 어깨"
"2:20:33","어깨 빵이 뭐 그냥 빵 치면 그냥 날아갑니다 저 그 목동에서 근처에서 뒷모습 보고 돌아갔 아아 무서워가"
"2:20:41","대성 캐스지 모르고 태가 태가 좀 부임하자아요 예 깡 적고"
"2:20:48","돌아갔어요 어쨌든 민 황선우 그리고 또 이제 우리나라 각 종목별로 또 선수들이"
"2:20:54","출전하는 황금 세대가 한번 뭉치는 시대니까 박태원에서리는 중교로 내일 여러분 한 저녁 무렵부터 함께 하시면"
"2:21:01","돼 새벽에도 근데 이게 좀 우리나라에서 보기 힘든게 아 너무 새벽 시간대라 예선은 프라임"
"2:21:08","타임인데네 이제 매달이 나올 수 있는 준결승 결승은 우리나라 새벽 시간이라"
"2:21:13","아하 3시 반 4시 정도 되네요네 그래도 많이 봐 주셨으면 좋겠습니다 많은 응원 부탁드리겠습니다네 많은"
"2:21:20","관심 부탁드리고 내일 아침부터 중요하 되니까 빨리 들어가서 쉬십시오네네 지금 침착하게 좀 더 고하고습니다"
"2:21:27","내일 게요 파이팅 파이팅"
"2:21:32","마린보이니다 원래 길게 잡아 놓으라 그랬는데 안 될 거 같아 우리가 재워야 돼 재워야 돼 나는 못 자지만"
"2:21:40","해설위원들은 재워야 됩니다 그 하고 계세요 저 화장수 갔다고요 뭐야까요네"
"2:21:45","의자 좀 들고 나와 주시 아 의자 예 화장실 간다고요네 제 방송은 원래 그래요 아 나가지 말까요 아 갔다"
"2:21:53","오세요 이거 올드 그예 이거를 개회식으로 돌려주세요"
"2:22:00","오 약간요 정도까지 올라갔던 거 같은데 와 거 끼 보세 와 이건"
"2:22:08","직관하고 싶다 지금 어디 하고 있는 거지"
"2:22:15","인터뷰 하느라고 순서를 놓쳤어요"
"2:22:33","아야 나카무라 프랑스의 대표적인 팝가수 자자로 전 세계 이름을 알리는"
"2:22:39","가수입니다 근데 키가 굉장히"
"2:22:46","크시네 버스 안에서가 아닙니다 짜 제목이 자예요 예 버스 안에서는"
"2:22:53","가수가 자자고 노래 제목이 버스 안에서"
"2:23:03","거꾸로 아이 비가 오는게 조금 아쉽네 아 비 오는게 여러분 보이시죠"
"2:23:28","여러분 레미 제라블 지나갔나요 아까 지나갔던 거 같은데"
"2:23:35","잠깐 토크하는 동안 음악이 들렸던 거 같은데"
"2:23:44","아쉽습니다 아 지금 평등 쪽으로 넘어갔구나 평등 그죠 어 지금 잘"
"2:23:53","어 왜 안 불렀어요 대네 지금 중요한 거 하고 있는데 뭐요 지금 재밌는 공이"
"2:24:01","맞습니다네 화장실 다녀오실 때 그 말씀하고 가세요네 편하게 갔다 오시면"
"2:24:06","됩니다 예 신문지 깔아야지 화장실 왜 가요 뭐 이런 채팅이 있는데 대변 패드 안"
"2:24:13","그래서 오늘 차에서 관련 토크를 하긴"
"2:24:19","했습니다만 아 아 좀 약간 중간 했는데 좀 좀 설명 좀 해주실 수"
"2:24:24","있는 지금은 평등 쪽으로 넘어왔어요 저희가 이제 주제가 오늘 길어요 그래가지고 아까부터 이제 파리의"
"2:24:31","사람들 그다음에 자유와 해방 그래서 이제 자유의 여신 그리고 레미제라블"
"2:24:37","이런 쪽이 나왔었고 어 그다음에 이제 누벨 바그도그라"
"2:24:43","이제 결국 어 자유평등 박게 아니겠습니까 이다음에 아마 바게"
"2:24:49","가지고 뭐 이런 쪽으로 가지 않을까 싶어요 전체적으로이 테마를 그렇게 맞췄구요 자유평등 박게 지금은 프랑스"
"2:24:56","음악들의 어떤 메들리를 보여주고 있습니다 아 끝났습니다"
"2:25:02","아 예 아이야 아카무라 프랑스의 대표적인 폭가네 자 지금 또 영상 아까 그분은"
"2:25:10","아직도 정체가 공개 안 됐어요 정체가 어떤 분이면 되게 김세"
"2:25:15","수도 있고 어떤 분이면 엄청 놀랄 수도 있어요 제가 이제 프랑스 분은 잘"
"2:25:22","아는 분이 많이 없어 가지고 프랑스하면 역시 근데 어느 나라나 축구 선수이 제일 유명합니다 뱅상"
"2:25:27","카슬 아 뱅상 카슬 어 뱅상 카슬 성화봉송 하셨는지 모르겠네 예 뱅상"
"2:25:36","카슬 혹시 혹시 완전 반전으로 마크롱 대통령이 마크롱 대통령 아니요 아니"
"2:25:43","아니 마크롱 대통령 아까 입장을 했고 대통령은 개회사를 하셔야 되기 때문에 성화봉송 할 수 없습니다 아니 그러서"
"2:25:48","딱 등장하면서 딱 하면서 그 개회사 아니 아니야 안 돼 안 돼 그렇게 안 돼 지금 보니까 팬싱"
"2:25:55","투구를 쓰고 있네요 예 혹시 이다도시 이다도시가 프랑스 뿐이에요"
"2:26:02","잘 저저 정확하긴 모르지만음 예 아 다 끊어서 나오는"
"2:26:14","연출 어 지금 아 바로 넘어가 형제입니다 먼저"
"2:26:22","형제 그래서 루브르 박물관음 예 키프로스 입장합니다 키프로스 키프로스"
"2:26:28","이제 영어로는 사이프러스 아고 합니다만 이제 우리나라 국립 국원 표기로는 키프로스 키프로스 예 독일"
"2:26:35","아니 독일 아니에 그리스 쪽에 이제 언어를 같이 비슷하게 쓰죠네라고 어"
"2:26:40","약간 동양적인 그 뒤에 백이 있는데요 뭐죠 동양이"
"2:26:46","아닌가 약간 뭐 범사는 콜롬비야 콜롬비야 모자 너무 이뻐요 메스의 나라 예"
"2:26:53","콜롬비아 놀랍게 전는 가봤습니다 콜롬비아 묶어 보시죠 그니까 아싸라비아 콜롬비아 할 때 그"
"2:26:59","콜롬비아 아아 그렇죠 아 안 가봤어요 저는이 보고타 가보고 까르따 헤나 메데인 이쪽으로 가봤습니다 좀 어"
"2:27:06","무서울 수도 있는 나라긴 한데 그래도 아름답더라고요 예 아 그래요 나르코스 나라 나르코스 아 그 나르코스 나라가"
"2:27:14","콜롬비아요리 1 2편 시즌이 콜롬비아 배경이죠 아"
"2:27:20","데 아싸라비아 콜롬비아까지 썼던 거 같은데 예 그 콜롬비아랑 아싸랑 무슨 상관이 길래"
"2:27:28","닭 잡아 먹고 삐약삐약 그게 세트 아니에요 아싸라비아 콜롬비아 닭 잡아먹고 삐약삐약 닭 잡아먹고"
"2:27:34","삐약삐약 아싸라비아 콜롬비아"
"2:27:43","예예 콩고 콩고 아 올림픽에서 메달이 아직 없었나 보네요 콩고가 아 그래"
"2:27:48","메달을 리고 근데 강에 이렇게 배를 뒤에 배경으로 이렇게 뛰어났는데 예술"
"2:27:54","그예 명화에 등장하는 공고에이어서 콩고 민주"
"2:28:00","공화국입니다 콩고 공화국 있고 콩고 민주공화국 맞아요 나라가 다르잖아요 그렇죠"
"2:28:06","어 우리나라가 보통 옛날에 그 킨샤샤 이기죠 예 예 그거가 이제 저죠 어"
"2:28:12","대한민국이다 어 저 뒤에 이제 예 쿡제도 쿡제도 다음에 나올 것"
"2:28:19","같습니다 자 다음 아 한국"
"2:28:27","있어요 어 한국 선수 마 많이 있네요 대한민국 요번에는 K 아니라"
"2:28:35","불러가 C 그래요고해 예 그래가지고 대한민국입니다"
"2:28:40","아 그래서 시 쪽에 꽤 앞부분에 등장하죠 예 오 어 우위를 또 이렇게 입 예"
"2:28:52","아 조금 쉬운게 비가 오네요 그죠 선수들이네 컨디션에 뭔가 예 그런게"
"2:28:57","없으면 좋겠는데 지금 보니까 코스타리카 맨 왼쪽 선수는 포기하고 그냥 비닐을 벗은 거 같아요 그리고"
"2:29:05","뭔가 찍고 있죠 예 예 인스타 36인 인스타 360이 아 이게 제가 봤을"
"2:29:11","때는 그 촬영 야외 촬영 해 보시면 아시겠지만 하나씩 들려 주거든요 그 맡으신 거 같아요 인스타 360"
"2:29:18","들어야 되 사람 보다 더 중요한이 인스타 360 기 고프 하나씩 주여 지거든요 그 한번 들어야 되는 것처럼"
"2:29:25","꼬드리 부아를 꽃리 브를 아이 영어로 하면 아이보리 코스트 한데 이제 브로라 코트 디브와음 오 드록바의"
"2:29:32","나라죠음 아 들어봤어요 저 디디에 드록바 드록 예 제발이 전쟁을 멈춰"
"2:29:38","주세요 3일간 자르 나라 이렇게 전쟁이 멈췄어요 멈췄어요 예 드록신"
"2:29:45","그렇죠 드록 크로아티아 크로아티아 우리나라가 브식 그니까 C 쪽에서 꽤"
"2:29:50","앞에 나왔네음 빨리 등장하는게 좋은 거죠 뒤로 갈수록 좀 약간 보시는"
"2:29:56","분들도 집중력이 좀 흐트러지 근데 보통 개최국이 맨 뒤에 나오니까 평창 때는 이제 하이라이트로 대한민국 맨"
"2:30:02","뒤에 나왔었거든요네 지금 나라가 등장할 때마다 나라에서 유명하신 분들에 대한 언급이 계속나요 뭐"
"2:30:09","크로아티아 뭐 모드리치 뭐 이런 식으로 맞아 대부분이 축구 선수들이죠 예 쿠바음"
"2:30:16","쿠바 쿠바 책계 봐라 그렇죠 제개 봐라 예 또 뭐 쿠바 또 누가 시가"
"2:30:22","시가 예 야구 잘하고 덴마크 덴마크 에릭센"
"2:30:28","덴마크 우유 덴마크 우유도 있고 우유도 있고 아 지금도 방금 방송 그"
"2:30:33","국계 신호 실수가 나왔죠 기가막히게 집어내 있네요 저 방금 못 봤거든요 심지어 말씀 안 해주시면 저 진짜"
"2:30:40","몰랐는데 또또 어 또또또또또 또 또또 프랑스어 아 근데 이게 야외에서 하다"
"2:30:45","보니까 아마 중계 차들 간의 이제 뭔가 그 전파 월경 이 아 그 확실히"
"2:30:51","해주세요 그 옹호를 해 주실 건지 지적을 하실 건지 단짠단짠으로"
"2:30:57","단짠단짠으로 너무 좀 약간 과하다 싶어서 좀 약간 예 너무 여러 번한 나오니까 한 번이면"
"2:31:04","지적하겠다 그서 또 또 그 아픔이 좀 느껴지는 거죠 아픔이 느껴집니다 왜냐면 이게 그런게 아닐텐데 야외에서"
"2:31:12","하자는 기획 그 총각 동구의 기획 때문에이 방송 인력들이 얼마나 힘들었겠어요 실지는 이미 정해진 거"
"2:31:19","거 구현해야 되니까 그죠 아마 애완이 좀 있었을 것 같은데 정해진 공간 주경기장에서 했으면은 너무나 간단하게"
"2:31:26","했을 수도 있는데네 지금은 중계차가 곳곳에 막서 있을 거예요 아마 아"
"2:31:33","맞습니다 아 근데 비우는게 너무 아쉽다 이거는이 기획은 비가 오면은"
"2:31:40","한 30% 정도 떨어지는 느낌이라 이게 아 이게 너무"
"2:31:47","아쉽네요 그 렌즈가 젖어 있잖아 아 그러니까요 근데"
"2:31:52","렌즈는네 주경기장에서 해도 졌지 않나요"
"2:31:57","그렇겠네요 졌는 건 아 근데 이게 위치마다 뭐 위치마다"
"2:32:04","이게 카메라 커트나 이런 것들이 예 어느 정도 루틴하게 돌아가면 저쪽 캠"
"2:32:10","갔을 때 요쪽 캠 닦아 주고 저쪽 캠 갈 때다 이게 있을텐데 지금은 카메라가 너무 많으니까 어 닦아줄"
"2:32:17","사람이 없어요 엘살바도르 로요네 여덟 명이 출전하네요 근데"
"2:32:23","종목도 일곱 종목이에요 그러니까 종목마다 거의 한 명 정도씩 있는 겁니다 그럼 여덟분이 지금 넘는 거"
"2:32:30","같은데 선수 단이가 임원들도 있고 음예 꼭 모두가 선수 플레이어는"
"2:32:37","아니고 아 그래요 임원이나 그 선수 뭐 코 스텝들도 같이 있을 수 있죠"
"2:32:42","형제들도 타도 돼요 형제들은 안 됩니다 예 선수단 하면 선수와 임원"
"2:32:48","어 아랍 에미리트 아랍 에미리트 파울로 벤투 감독이 지금"
"2:32:56","저쪽을 지휘하고 있죠음 예 근데 벤투 감독님이 아랍 에미리트 뿐은 아니긴"
"2:33:01","한데 아 근데 이게 화면 전환이 일부러 이렇게 되는 건가 약간 깨지죠"
"2:33:08","지금 예 이렇게 이렇게 화면 전환되는 거는 일부러 한 거 같기도 한데 그게"
"2:33:14","깨지는 부분이 조금 그러네요 스크롤이 아니 아무리 봐도 일부러는 아니요 또 췄 아우 일부러는 아니에요 아 이게"
"2:33:20","중계가 중계차가 이게 뭐 LT 그런 쪽인가 보다 이게 너무 너무"
"2:33:27","잦으니까 이거는 이제 받아들이게 되네요 그냥 아 근데 저는이 오히려 이제 무서워요 방귀가 잦으면 똥이"
"2:33:34","나온다고 그러거든요이 끊길까 봐 아예 끊길까 봐 저"
"2:33:40","재밌는이 계이 계속 보고 싶은데 에서서 예 방자 똥은 두번째로"
"2:33:46","들어보네요 이게 속담이 속담 우리 소주한 우리 우리 민족의 속담"
"2:33:53","그렇죠 아 스페인 선수단이 많구나 지금 이렇게 자꾸 이게 확실히"
"2:33:59","자꾸 끊기는 거 보면 조금 우려가 되네요 아 지난 유로"
"2:34:04","2024 제가 중계한 결승전 여러 보셨죠 예 예 알카라스이 테니스 또"
"2:34:10","신흥 황제를 꿈꾸고 있습니다 에스토니아 에스토니아"
"2:34:17","예 지금 보면은 비를 비옷을 인원수대로 지급을 안"
"2:34:23","하나요 처음에 저는 그냥 포기하고 벗신 거들 같은데 양보한 걸지도 모르겠다는 생각을 좀 해봅니다 아"
"2:34:30","숫자 못 맞췄네 수대로 지금이 안 이게 오징어 게임이"
"2:34:36","아닌가 어 어 여기는 비닐을 과감하게음 좀 약간 방수가 되는"
"2:34:42","재질로 입으셔야 안 입으신 건가 아 사실 평생에 한번 오는 올림픽이 거기"
"2:34:48","이제네 또 개회식에 오셨는데 또 이런 지금 선수당 규모가 작은거 보니까"
"2:34:53","진짜 한번 올까 말까 하는 분들이 대부분일 수도 있어요 그러니까음 에티오피아 에티오피아 예 어 흥이 다"
