"2:18:14","오래됐다은 아 근데 그게 있어이 초반에 그 근데 그 수영이 아까"
"2:18:19","얘기한 것처럼 올림픽에 전반부를 담당하는데 그 맨 앞에 4유형"
"2:18:25","400이 있어요 아 베이징 20년도 안 됐어요 예 최근이에요 아"
"2:18:30","그래가지고 얼마 16년 16년 됐나 그래서 이제 16년 이면은 8 10년"
"2:18:37","안 됐네 내일이 딱 그거거든 16년 전처럼 이제 남자 자유형 400m"
"2:18:42","김우민 선수가 딱 도전하는 곧 내일이 바로 시작하니까 내일 우리나라 또"
"2:18:48","수영 강하지 않아요 어 지금 예 황금 황금 세대 예 넥타이 색깔 아 아"
"2:18:55","그렇죠 황금 세대 그래서 그 아까 그 낮에 그 배성재 캐신 님하고 이제 식사하면서 많이 기대하고 계시더라고요"
"2:19:02","수영 어네네네음 내일 침착맨 do 수영장에 또 맞아요 또 별 거예요"
"2:19:07","아마 내일 내일 오세요 현장 이제 응원 응원하러 파병 님하고 예 어 두"
"2:19:12","분 같이 오시는구나 그렇죠 예 저희는 그 세트예요 올림픽에서는 침착한 바리 지행 해가지고 어 좋다 좋다"
"2:19:19","그러니까네 자 어쨌든 이번에 그러면 박 김민 선수랑 그다음에 황선우 선수"
"2:19:25","황선우 선수 그리고 이제 또 단체전 예 개형 800m"
"2:19:30","있는데음 아 내심 좀 아쉬 저는 개인적으로 좀 아쉬운 점도 있어요 왜"
"2:19:37","이런 훌륭한 선수들이네 이제 나왔을까 왜 내가 했을 때는 안 나왔을까 태연이 할"
"2:19:45","때는 혼자 거의 다 전 종목 뭐 100m 터 10000m 아지 네네네"
"2:19:51","아 그게 같이 이게 딱 이게 그 시기가 겹치면 아무래도 좀 더"
"2:19:56","시너지가 있나요 그럼요 왜냐면 이제 미국 같은 데는 수영 강한 선수들이 여럿 있으니까 예 아 제가 해설하고"
"2:20:03","앉아 있네요 예 사실 저도 YMC 수영 선수 출신이거든요 선배님이 될"
"2:20:09","뻔하다가 아 근데 왜 무슨 이유로 저는 또 말하는게 더"
"2:20:15","좋아서 먹는게 먹는게 더 좋아서 아 아 제 몸 쓰는 거보다 말이 낫다"
"2:20:22","말이 낫다 앉아 있는게 편하니까 재능이 많은 것도 참 사실 힘든 일이에요 말도 잘하고 운동도 잘하고"
"2:20:28","예 예 몸 보세요 거의 뭐 어깨 빵이 제가 어깨 빵이 아니라 여기 어깨"
"2:20:33","어깨 빵이 뭐 그냥 빵 치면 그냥 날아갑니다 저 그 목동에서 근처에서 뒷모습 보고 돌아갔 아아 무서워가"
"2:20:41","대성 캐스지 모르고 태가 태가 좀 부임하자아요 예 깡 적고"
"2:20:48","돌아갔어요 어쨌든 민 황선우 그리고 또 이제 우리나라 각 종목별로 또 선수들이"
"2:20:54","출전하는 황금 세대가 한번 뭉치는 시대니까 박태원에서리는 중교로 내일 여러분 한 저녁 무렵부터 함께 하시면"
"2:21:01","돼 새벽에도 근데 이게 좀 우리나라에서 보기 힘든게 아 너무 새벽 시간대라 예선은 프라임"
"2:21:08","타임인데네 이제 매달이 나올 수 있는 준결승 결승은 우리나라 새벽 시간이라"
"2:21:13","아하 3시 반 4시 정도 되네요네 그래도 많이 봐 주셨으면 좋겠습니다 많은 응원 부탁드리겠습니다네 많은"
"2:21:20","관심 부탁드리고 내일 아침부터 중요하 되니까 빨리 들어가서 쉬십시오네네 지금 침착하게 좀 더 고하고습니다"
"2:21:27","내일 게요 파이팅 파이팅"
"2:21:32","마린보이니다 원래 길게 잡아 놓으라 그랬는데 안 될 거 같아 우리가 재워야 돼 재워야 돼 나는 못 자지만"
"2:21:40","해설위원들은 재워야 됩니다 그 하고 계세요 저 화장수 갔다고요 뭐야까요네"
"2:21:45","의자 좀 들고 나와 주시 아 의자 예 화장실 간다고요네 제 방송은 원래 그래요 아 나가지 말까요 아 갔다"
"2:21:53","오세요 이거 올드 그예 이거를 개회식으로 돌려주세요"
"2:22:00","오 약간요 정도까지 올라갔던 거 같은데 와 거 끼 보세 와 이건"
"2:22:08","직관하고 싶다 지금 어디 하고 있는 거지"
"2:22:15","인터뷰 하느라고 순서를 놓쳤어요"
"2:22:33","아야 나카무라 프랑스의 대표적인 팝가수 자자로 전 세계 이름을 알리는"
"2:22:39","가수입니다 근데 키가 굉장히"
"2:22:46","크시네 버스 안에서가 아닙니다 짜 제목이 자예요 예 버스 안에서는"
"2:22:53","가수가 자자고 노래 제목이 버스 안에서"
"2:23:03","거꾸로 아이 비가 오는게 조금 아쉽네 아 비 오는게 여러분 보이시죠"
"2:23:28","여러분 레미 제라블 지나갔나요 아까 지나갔던 거 같은데"
"2:23:35","잠깐 토크하는 동안 음악이 들렸던 거 같은데"
"2:23:44","아쉽습니다 아 지금 평등 쪽으로 넘어갔구나 평등 그죠 어 지금 잘"
"2:23:53","어 왜 안 불렀어요 대네 지금 중요한 거 하고 있는데 뭐요 지금 재밌는 공이"
"2:24:01","맞습니다네 화장실 다녀오실 때 그 말씀하고 가세요네 편하게 갔다 오시면"
"2:24:06","됩니다 예 신문지 깔아야지 화장실 왜 가요 뭐 이런 채팅이 있는데 대변 패드 안"
"2:24:13","그래서 오늘 차에서 관련 토크를 하긴"
"2:24:19","했습니다만 아 아 좀 약간 중간 했는데 좀 좀 설명 좀 해주실 수"
"2:24:24","있는 지금은 평등 쪽으로 넘어왔어요 저희가 이제 주제가 오늘 길어요 그래가지고 아까부터 이제 파리의"
"2:24:31","사람들 그다음에 자유와 해방 그래서 이제 자유의 여신 그리고 레미제라블"
"2:24:37","이런 쪽이 나왔었고 어 그다음에 이제 누벨 바그도그라"
"2:24:43","이제 결국 어 자유평등 박게 아니겠습니까 이다음에 아마 바게"
"2:24:49","가지고 뭐 이런 쪽으로 가지 않을까 싶어요 전체적으로이 테마를 그렇게 맞췄구요 자유평등 박게 지금은 프랑스"
"2:24:56","음악들의 어떤 메들리를 보여주고 있습니다 아 끝났습니다"
"2:25:02","아 예 아이야 아카무라 프랑스의 대표적인 폭가네 자 지금 또 영상 아까 그분은"
"2:25:10","아직도 정체가 공개 안 됐어요 정체가 어떤 분이면 되게 김세"
"2:25:15","수도 있고 어떤 분이면 엄청 놀랄 수도 있어요 제가 이제 프랑스 분은 잘"
"2:25:22","아는 분이 많이 없어 가지고 프랑스하면 역시 근데 어느 나라나 축구 선수이 제일 유명합니다 뱅상"
"2:25:27","카슬 아 뱅상 카슬 어 뱅상 카슬 성화봉송 하셨는지 모르겠네 예 뱅상"
"2:25:36","카슬 혹시 혹시 완전 반전으로 마크롱 대통령이 마크롱 대통령 아니요 아니"
"2:25:43","아니 마크롱 대통령 아까 입장을 했고 대통령은 개회사를 하셔야 되기 때문에 성화봉송 할 수 없습니다 아니 그러서"
"2:25:48","딱 등장하면서 딱 하면서 그 개회사 아니 아니야 안 돼 안 돼 그렇게 안 돼 지금 보니까 팬싱"
"2:25:55","투구를 쓰고 있네요 예 혹시 이다도시 이다도시가 프랑스 뿐이에요"
"2:26:02","잘 저저 정확하긴 모르지만음 예 아 다 끊어서 나오는"
"2:26:14","연출 어 지금 아 바로 넘어가 형제입니다 먼저"
"2:26:22","형제 그래서 루브르 박물관음 예 키프로스 입장합니다 키프로스 키프로스"
"2:26:28","이제 영어로는 사이프러스 아고 합니다만 이제 우리나라 국립 국원 표기로는 키프로스 키프로스 예 독일"
"2:26:35","아니 독일 아니에 그리스 쪽에 이제 언어를 같이 비슷하게 쓰죠네라고 어"
"2:26:40","약간 동양적인 그 뒤에 백이 있는데요 뭐죠 동양이"
"2:26:46","아닌가 약간 뭐 범사는 콜롬비야 콜롬비야 모자 너무 이뻐요 메스의 나라 예"
"2:26:53","콜롬비아 놀랍게 전는 가봤습니다 콜롬비아 묶어 보시죠 그니까 아싸라비아 콜롬비아 할 때 그"
"2:26:59","콜롬비아 아아 그렇죠 아 안 가봤어요 저는이 보고타 가보고 까르따 헤나 메데인 이쪽으로 가봤습니다 좀 어"
"2:27:06","무서울 수도 있는 나라긴 한데 그래도 아름답더라고요 예 아 그래요 나르코스 나라 나르코스 아 그 나르코스 나라가"
"2:27:14","콜롬비아요리 1 2편 시즌이 콜롬비아 배경이죠 아"
"2:27:20","데 아싸라비아 콜롬비아까지 썼던 거 같은데 예 그 콜롬비아랑 아싸랑 무슨 상관이 길래"
"2:27:28","닭 잡아 먹고 삐약삐약 그게 세트 아니에요 아싸라비아 콜롬비아 닭 잡아먹고 삐약삐약 닭 잡아먹고"
"2:27:34","삐약삐약 아싸라비아 콜롬비아"
"2:27:43","예예 콩고 콩고 아 올림픽에서 메달이 아직 없었나 보네요 콩고가 아 그래"
"2:27:48","메달을 리고 근데 강에 이렇게 배를 뒤에 배경으로 이렇게 뛰어났는데 예술"
"2:27:54","그예 명화에 등장하는 공고에이어서 콩고 민주"
"2:28:00","공화국입니다 콩고 공화국 있고 콩고 민주공화국 맞아요 나라가 다르잖아요 그렇죠"
"2:28:06","어 우리나라가 보통 옛날에 그 킨샤샤 이기죠 예 예 그거가 이제 저죠 어"
"2:28:12","대한민국이다 어 저 뒤에 이제 예 쿡제도 쿡제도 다음에 나올 것"
"2:28:19","같습니다 자 다음 아 한국"
"2:28:27","있어요 어 한국 선수 마 많이 있네요 대한민국 요번에는 K 아니라"
"2:28:35","불러가 C 그래요고해 예 그래가지고 대한민국입니다"
"2:28:40","아 그래서 시 쪽에 꽤 앞부분에 등장하죠 예 오 어 우위를 또 이렇게 입 예"
"2:28:52","아 조금 쉬운게 비가 오네요 그죠 선수들이네 컨디션에 뭔가 예 그런게"
"2:28:57","없으면 좋겠는데 지금 보니까 코스타리카 맨 왼쪽 선수는 포기하고 그냥 비닐을 벗은 거 같아요 그리고"
"2:29:05","뭔가 찍고 있죠 예 예 인스타 36인 인스타 360이 아 이게 제가 봤을"
"2:29:11","때는 그 촬영 야외 촬영 해 보시면 아시겠지만 하나씩 들려 주거든요 그 맡으신 거 같아요 인스타 360"
"2:29:18","들어야 되 사람 보다 더 중요한이 인스타 360 기 고프 하나씩 주여 지거든요 그 한번 들어야 되는 것처럼"
"2:29:25","꼬드리 부아를 꽃리 브를 아이 영어로 하면 아이보리 코스트 한데 이제 브로라 코트 디브와음 오 드록바의"
"2:29:32","나라죠음 아 들어봤어요 저 디디에 드록바 드록 예 제발이 전쟁을 멈춰"
"2:29:38","주세요 3일간 자르 나라 이렇게 전쟁이 멈췄어요 멈췄어요 예 드록신"
"2:29:45","그렇죠 드록 크로아티아 크로아티아 우리나라가 브식 그니까 C 쪽에서 꽤"
"2:29:50","앞에 나왔네음 빨리 등장하는게 좋은 거죠 뒤로 갈수록 좀 약간 보시는"
"2:29:56","분들도 집중력이 좀 흐트러지 근데 보통 개최국이 맨 뒤에 나오니까 평창 때는 이제 하이라이트로 대한민국 맨"
"2:30:02","뒤에 나왔었거든요네 지금 나라가 등장할 때마다 나라에서 유명하신 분들에 대한 언급이 계속나요 뭐"
"2:30:09","크로아티아 뭐 모드리치 뭐 이런 식으로 맞아 대부분이 축구 선수들이죠 예 쿠바음"
"2:30:16","쿠바 쿠바 책계 봐라 그렇죠 제개 봐라 예 또 뭐 쿠바 또 누가 시가"
"2:30:22","시가 예 야구 잘하고 덴마크 덴마크 에릭센"
"2:30:28","덴마크 우유 덴마크 우유도 있고 우유도 있고 아 지금도 방금 방송 그"
"2:30:33","국계 신호 실수가 나왔죠 기가막히게 집어내 있네요 저 방금 못 봤거든요 심지어 말씀 안 해주시면 저 진짜"
"2:30:40","몰랐는데 또또 어 또또또또또 또 또또 프랑스어 아 근데 이게 야외에서 하다"
"2:30:45","보니까 아마 중계 차들 간의 이제 뭔가 그 전파 월경 이 아 그 확실히"
"2:30:51","해주세요 그 옹호를 해 주실 건지 지적을 하실 건지 단짠단짠으로"
"2:30:57","단짠단짠으로 너무 좀 약간 과하다 싶어서 좀 약간 예 너무 여러 번한 나오니까 한 번이면"
"2:31:04","지적하겠다 그서 또 또 그 아픔이 좀 느껴지는 거죠 아픔이 느껴집니다 왜냐면 이게 그런게 아닐텐데 야외에서"
"2:31:12","하자는 기획 그 총각 동구의 기획 때문에이 방송 인력들이 얼마나 힘들었겠어요 실지는 이미 정해진 거"
"2:31:19","거 구현해야 되니까 그죠 아마 애완이 좀 있었을 것 같은데 정해진 공간 주경기장에서 했으면은 너무나 간단하게"
"2:31:26","했을 수도 있는데네 지금은 중계차가 곳곳에 막서 있을 거예요 아마 아"
"2:31:33","맞습니다 아 근데 비우는게 너무 아쉽다 이거는이 기획은 비가 오면은"
"2:31:40","한 30% 정도 떨어지는 느낌이라 이게 아 이게 너무"
"2:31:47","아쉽네요 그 렌즈가 젖어 있잖아 아 그러니까요 근데"
"2:31:52","렌즈는네 주경기장에서 해도 졌지 않나요"
"2:31:57","그렇겠네요 졌는 건 아 근데 이게 위치마다 뭐 위치마다"
"2:32:04","이게 카메라 커트나 이런 것들이 예 어느 정도 루틴하게 돌아가면 저쪽 캠"
"2:32:10","갔을 때 요쪽 캠 닦아 주고 저쪽 캠 갈 때다 이게 있을텐데 지금은 카메라가 너무 많으니까 어 닦아줄"
"2:32:17","사람이 없어요 엘살바도르 로요네 여덟 명이 출전하네요 근데"
"2:32:23","종목도 일곱 종목이에요 그러니까 종목마다 거의 한 명 정도씩 있는 겁니다 그럼 여덟분이 지금 넘는 거"
"2:32:30","같은데 선수 단이가 임원들도 있고 음예 꼭 모두가 선수 플레이어는"
"2:32:37","아니고 아 그래요 임원이나 그 선수 뭐 코 스텝들도 같이 있을 수 있죠"
"2:32:42","형제들도 타도 돼요 형제들은 안 됩니다 예 선수단 하면 선수와 임원"
"2:32:48","어 아랍 에미리트 아랍 에미리트 파울로 벤투 감독이 지금"
"2:32:56","저쪽을 지휘하고 있죠음 예 근데 벤투 감독님이 아랍 에미리트 뿐은 아니긴"
"2:33:01","한데 아 근데 이게 화면 전환이 일부러 이렇게 되는 건가 약간 깨지죠"
"2:33:08","지금 예 이렇게 이렇게 화면 전환되는 거는 일부러 한 거 같기도 한데 그게"
"2:33:14","깨지는 부분이 조금 그러네요 스크롤이 아니 아무리 봐도 일부러는 아니요 또 췄 아우 일부러는 아니에요 아 이게"
"2:33:20","중계가 중계차가 이게 뭐 LT 그런 쪽인가 보다 이게 너무 너무"
"2:33:27","잦으니까 이거는 이제 받아들이게 되네요 그냥 아 근데 저는이 오히려 이제 무서워요 방귀가 잦으면 똥이"
"2:33:34","나온다고 그러거든요이 끊길까 봐 아예 끊길까 봐 저"
"2:33:40","재밌는이 계이 계속 보고 싶은데 에서서 예 방자 똥은 두번째로"
"2:33:46","들어보네요 이게 속담이 속담 우리 소주한 우리 우리 민족의 속담"
"2:33:53","그렇죠 아 스페인 선수단이 많구나 지금 이렇게 자꾸 이게 확실히"
"2:33:59","자꾸 끊기는 거 보면 조금 우려가 되네요 아 지난 유로"
"2:34:04","2024 제가 중계한 결승전 여러 보셨죠 예 예 알카라스이 테니스 또"
"2:34:10","신흥 황제를 꿈꾸고 있습니다 에스토니아 에스토니아"
"2:34:17","예 지금 보면은 비를 비옷을 인원수대로 지급을 안"
"2:34:23","하나요 처음에 저는 그냥 포기하고 벗신 거들 같은데 양보한 걸지도 모르겠다는 생각을 좀 해봅니다 아"
"2:34:30","숫자 못 맞췄네 수대로 지금이 안 이게 오징어 게임이"
"2:34:36","아닌가 어 어 여기는 비닐을 과감하게음 좀 약간 방수가 되는"
"2:34:42","재질로 입으셔야 안 입으신 건가 아 사실 평생에 한번 오는 올림픽이 거기"
"2:34:48","이제네 또 개회식에 오셨는데 또 이런 지금 선수당 규모가 작은거 보니까"
"2:34:53","진짜 한번 올까 말까 하는 분들이 대부분일 수도 있어요 그러니까음 에티오피아 에티오피아 예 어 흥이 다"
"2:35:02","진짜 사람들이 진짜 흥이 많네요 그렇죠 저 흥은 못 이기죠"
"2:35:10","어 자 어우 국기 멋있네요 저"
"2:35:15","별 아 피지 피지 피지 아 전통의상으로 보이는데 저 저 옷도"
"2:35:22","너무 이예쁜 거야 그죠 아름답네 피지 국기가 하늘 새끼 들어가 있어 가지고 이쁘네 저 이제 고등학교 3학년 때"
"2:35:28","고등학교 2학년 때 아 1학년 때구나 어 pgr 휴가 갔어요 아니요 pges 전화고 전학생 있었어요 아"
"2:35:35","그래요 한국인인데 PG 이제 아버님이 목사라서 성교 활동하다가 돌아왔거든요"
"2:35:41","어 반갑네요 어 예전에 저희 때는 이제 피지로 희석하고 이런 사람들이"
"2:35:47","부회 상징이었고 아예 아 그 친구는 아니었어요 그래서 그 친구 거의"
"2:35:52","pgs 좀 외로웠다고 하더라고요네 항상 저항의 역사였다고"
"2:35:57","아 그랜드 피아노가 젖었어 [음악]"
"2:36:02","아 비가 와서 꽤 많이 오나 봐요 비가 지금 예 가봉 가봉"
"2:36:12","예 가봉 이제 오바메양의 나라죠음 오바마 오바메양 굉장히 빠른"
"2:36:19","선수 있습니다 예 오바메양 오 옛날에 아우바메양이라고 자 또 이분 나옵니다"
"2:36:25","어 모나리 모나리 아 지금 루브르가 지금 근처 있는데 지금 못 가고 갈 거 같아요"
"2:36:31","한국에 좀 아쉽습니다 나 나도 지금 에펠탑도 못 봤어 여러분 여기 진짜 일만 하러 왔습니다이 옛날에 도난당한"
"2:36:39","뭐 그 사건을 좀 약간 모티브로 해서 만든 거 같기도하고 약간 리팩 느낌도"
"2:36:44","주는 거 같고요네 아 저 연주자 감기"
"2:36:50","걸리겠는데요 지금 옷에 땡땡이가 원래 있는 건가요 아니면 물이"
"2:36:56","물방울이 땡땡이 한 70% 물이 30% 거 같습니다 인체"
"2:37:03","예 아니 제가 봤을 때는 자연스럽게 반짝이는게 있고"
"2:37:09","약간 아 근데 오히려 사네 지금 근데 더 뭐게 분위기가 진짜 말씀하신 대로"
"2:37:15","좀 더 사는 건 있네요 아 근데 이렇게 보니까 비가 많이 오네 진짜 많이 와요 너무 속상하다 근데 이게"
"2:37:21","이게 소리가 비가 이렇게 오는데도 잘 들리네요 그러니까 이게 미끄러질 만도"
"2:37:27","한데 대단한 분이네 알렉상드르 칸토로프 아는 분입니다 프랑스 출신의"
"2:37:35","세계적인 피아니스트 차이콥스키 국제 콘크 우승한 최초의"
"2:37:42","프랑스인음이 인터넷 방송에서는 아직 안 끝났어요네 아직 안 끝났어 클래식"
"2:37:47","공연장 예단 갔을 때 박수 타이밍 잘 잡아야 되죠 아니 두 번 치면 안 돼요 이때도 좋고 끝날 때도 좋으면"
"2:37:54","아 그럴 수도 있죠 예 아 그 마지막에 딱 해야 되나 봐요 저 잘 몰라가 아까 치는게 맞았나 보다 이게"
"2:38:01","뭐야 국가로 넘어오는 거 보니까 감비아 아니에요 지금 연주가 계속"
"2:38:06","하고 있어요 그런가 예 연주하고 있습니다"
"2:38:12","비아 어 조지아 예전엔 그루지아 불렸는데 이제는 조지아로 예 차의"
"2:38:22","나라 십자가가 굉장히 많네요음 흡 이차 크바치 엘리아의"
"2:38:27","나라 그 아제르바이 근처에 있죠 그죠 가까이"
"2:38:33","있죠 아 근데 나라들 지나가니까 커피 마시고 싶은 느낌들이 와 아원"
"2:38:41","미쳤다 가나 보통 미쳤다는 표현 그 그 지상파에서 해도 되나요 그 정도는"
"2:38:46","뭐 칭찬 도가 약이 그렇죠 그 칭찬이면 근데 자 너무 막 자주하면"
"2:38:52","안 되고 예 커피 마시면 커피 좀 하나 드릴까요 커피 마시면서 초콜릿 먹고 싶네요 커피 좀 저 요청하면 좀"
"2:38:59","해주 해 주실 수 있는데 아니 저 마실게요 그 안 드신다고 했어요 아"
"2:39:04","마실게요 아 마실거예요 나가려고 또 아 저이 요청만 드리고 다시 올게요"
"2:39:09","나가려고 또 자 여러분 어떻게 저희랑 함께 하는게 재밌으니까 아니면 그냥 어"
"2:39:16","특이해서 그냥 보고 계신 걸까요"
"2:39:23","영국입니다 영국 가지 말라고 하셔가지고 영국은 묘하게 다리 아래로 지나가고 있는데 잡아주네요 아 중계"
"2:39:29","왜 이렇게 재밌지 그레이트 브리트 또 스포츠의 어떤"
"2:39:36","발상지 여러 종목의 발상지이기도 하고 스포츠 또 간국 중에 하나죠 어 연구"
"2:39:42","예 어 저 저분 이렇게 좀 시무룩해 보이죠 저 별로 약간 아까 날씨"
"2:39:49","좋았는데 비올 때 등장하니까 좀 좀 뚱 하신 거 같아요 예 매트 리처즈"
"2:39:55","이제 수영 선수인데 우리나라 선수들이랑 특히 황선호 선수랑 더 경쟁하는 선수입니다음 매슈 국익 국원"
"2:40:02","표기법으로 아쉽게도 매슈 리처즈 아고 표시하게 되는데 매튜 매튜 리처즈"
"2:40:08","어 그레나다데 이런 거 보면은 진짜 지구의 나라가 진짜 많고 다양한"
"2:40:14","인종들이 살고 그런게 이제 더 느껴지네요 문화도 조금씩 막 이렇게"
"2:40:19","근처 나라 된 그라데이션은 조금씩 다르고 그것도 되게 확실히 올림픽이나"
"2:40:25","이제 월드컵 보면 느껴져요 근데 이제 월드컵은 예선을 통과하지 못하는 나라들도 많은데 올림픽은 거의"
"2:40:33","대부분의 나라들을 함께 볼 수 있으니까"
"2:40:38","구암 과테말라 비가 오는데도 저렇게 열정적으로 아 이게 인생의 한 번뿐인"
"2:40:46","순간일 수도 있으니까 그죠 전 세계에 나가는 거니까 얼마나 기분 좋겠어 다들 근데 폰을 들고"
"2:40:52","있네 막 아 신 신나셨어 와 저또 백으로 저기 저기"
"2:41:01","저 뭔지 모르겠는데 베르사유 기니 베르사의 공장인가 저"
"2:41:07","못 봤어요 전"
"2:41:13","기니 조금 있으면 아마 오르세미술관 나올 것 같습니다 오르도 못 가봤죠"
"2:41:19","저 봤어요 봤어요 엊그저께 그냥 외관만 봤어요 외관만 왜냐면"
"2:41:24","촬영하다가 근처 가지고 걸어서 그것만 보고 들어가자 해서 잠깐 봤습니다음 저는 리우 올림픽 갔다가"
"2:41:33","파리를 경유하는데 혼자 SBS 직원들 다음 비행기 바로 타고 저는 쓱 혼자"
"2:41:38","빠져 가지고 하루 빠루 빨리 있었거든요네 그때 본게 사실 빨이 대부분이 오랑주리 미술관 뽕삐두"
"2:41:45","미술관 그다음에 개선문 에펠탑 그때 보고 파리 이렇게 지금 3일째 있는데 아직"
"2:41:52","제대로 파리를 보지도 못했어요 아 저 아까"
"2:41:58","그 좀 받은 건데 좀 드실래요 이게 뭐야 누텔라 누텔라"
"2:42:05","악마에 먹으면서 해도 되나 그럼 말을 못 하는데 말 안 하면"
"2:42:11","되죠음 하나 더 주세요 아니야세요"
"2:42:23","우리가 먹어야 시청자분들도 먹습니다 아이고"
"2:42:29","키 시키신이라고 하니까 질한 거 같잖아 아 아니 아니 제가 갔다 오려고 했는데 제가 이런 말을"
"2:42:35","덧붙였어요 문제 없지 예 시키신 커피 왔습니다 제가 갔다 오면 유인 님이"
"2:42:40","화 내신다고 제가 어쩔 수 없이 아이다"
"2:42:49","아도 이제 프랑스어를 쓰죠"
"2:42:55","it 진짜 아라고 하니까 진짜 앵무새처럼 똑같이 it 간고 it 광고 다 똑같은 말"
"2:43:02","채팅"
"2:43:09","온드라스 근데 이게 비가 와 가지고네 수심이 점점 깊어지니까 저 앞 저"
"2:43:14","조형물 분들 코가 잠기는 거 같잖아요 예 서서히 숨이 막히는 느낌이 드는데"
"2:43:19","이것까지 포함해서 연출인가 혹시 홍콩"
"2:43:26","차이나 여기 선수단이"
"2:43:32","많네요음 헝가리 아 홍콩 여행가 본지 오래됐네"
"2:43:38","헝가리 헝가리는 우리나라와 이제 그 성 이름순 그 순서가 같죠음 딱"
"2:43:44","서양인데 불구하고 약간 헝가리는 앞에가 먼저 나옵니다 우리나라 성 그래고 앞에 있는"
"2:43:50","게임이죠 어 그래요 예 그래서 마틴 아담 마틴 아담 뭐 성가리 선수 근데"
"2:43:56","이제 사실 어 아담 마틴이 생각해보니까 거기 어디가 성인지 모르겠네 둘 다 이름 같네 아 그러네"
"2:44:02","응 인디아"
"2:44:08","인도음 또 휴대폰으로 또 찍고"
"2:44:13","있습니다음 아 커리가 갑자기 또 먹고 싶네요네 뒤에는"
"2:44:20","인도네시아 인도네시아 인도네시아랑 폴란드가 항상 국기가 헷갈리죠 예 똑같이 빨강"
"2:44:27","하양인 뒤집혀 있습니다 이게 지식의 저주인가요 저는 안 헷갈렸어요 왜냐면"
"2:44:34","모르니까요음 아 지금 몇 시야 거기 4시 아닙니까 곧네 곧"
"2:44:41","시예요 한국 4시야네 아 맞춰줘 자기 시청자들"
"2:44:48","있데 뭘 맞 뭘 맞추라는 거야 캐스터 님한테 맞추라는 거예요"
"2:44:53","아니면 신청 신청자분들 테 맞춰야죠 맞춰줘이란 나왔습니다이란"
